<?xml version="1.0" encoding="UTF-8"?>
<!DOCTYPE vendes SYSTEM "vendes.dtd">
<vendes>
    <venda>
        <vendacredit>
            <datapagament>10/04/2024</datapagament>
            <quantitat>5</quantitat>
        </vendacredit>
        <vendainmediata>
            <quantity>3</quantity>
            <divisa>â‚¬</divisa>
        </vendainmediata>
    </venda>
    <venda>
    </venda>
    <venda>
        <vendacredit>
            <datapagament>19/12/2023</datapagament>
            <quantitat>10</quantitat>
        </vendacredit>
    </venda>
    <venda>
        <vendainmediata>
            <quantity>45</quantity>
            <divisa>$</divisa>
        </vendainmediata>
    </venda>
</vendes>